{
  "acceptance_agent": null,
  "acceptance_owner": null,
  "acceptance_status": "draft",
  "accepted_at": null,
  "admission_eligible": false,
  "artifact_manifest_sha256": "edb1d13f2cd8cf6ddca6907f8dc4e9d40537b24d778510c34d95bd0423181041",
  "bytecode_opcode_scan": {
    "bytecode_path": "dataset/artifacts/celer_cbridge/bytecode/CBridge.deployed.hex",
    "bytecode_sha256": "3882a177a7e1e767b7f37c2b8f8dd0112f26f356e3e12b0b509330a327d0cc17",
    "scan_hash": "97545b5ab62cb6c737d21b9a44a30c8858b986310ab18a67e22d24339ffa10fe",
    "unique_opcodes": [
      "0x0d",
      "0x22",
      "0x2c",
      "0xa1",
      "0xa2",
      "0xad",
      "0xce",
      "0xd2",
      "0xdd",
      "0xec",
      "0xef",
      "ADD",
      "ADDRESS",
      "AND",
      "CALL",
      "CALLDATACOPY",
      "CALLDATASIZE",
      "CALLER",
      "CALLVALUE",
      "CHAINID",
      "DIV",
      "DUP1",
      "DUP10",
      "DUP11",
      "DUP13",
      "DUP2",
      "DUP3",
      "DUP4",
      "DUP5",
      "DUP6",
      "DUP7",
      "DUP8",
      "DUP9",
      "EQ",
      "EXTCODECOPY",
      "EXTCODEHASH",
      "GAS",
      "GT",
      "INVALID",
      "ISZERO",
      "JUMP",
      "JUMPDEST",
      "JUMPI",
      "LT",
      "MLOAD",
      "MSTORE",
      "MUL",
      "NOT",
      "OR",
      "POP",
      "PUSH1",
      "PUSH12",
      "PUSH18",
      "PUSH2",
      "PUSH28",
      "PUSH3",
      "PUSH30",
      "PUSH32",
      "PUSH4",
      "PUSH5",
      "PUSH8",
      "PUSH9",
      "RETURN",
      "RETURNDATACOPY",
      "REVERT",
      "SELFBALANCE",
      "SHA3",
      "SHL",
      "SHR",
      "SLOAD",
      "SLT",
      "SSTORE",
      "STOP",
      "SUB",
      "SWAP1",
      "SWAP15",
      "SWAP2",
      "SWAP3",
      "SWAP4",
      "SWAP5",
      "SWAP6",
      "SWAP7",
      "SWAP8",
      "SWAP9",
      "TIMESTAMP"
    ]
  },
  "evidence_scope": "source_backed_development_host_draft",
  "independent_differential_required": true,
  "independent_validation_required": false,
  "lineage_id": "celer_cbridge",
  "matrix": {
    "acceptance_agent": null,
    "acceptance_owner": null,
    "acceptance_status": "draft",
    "accepted_at": null,
    "engine": "foundry-evm",
    "engine_revision": "ghcr.io/foundry-rs/foundry@sha256:0c00cb0bda1ab1b91c9a6bf60f4c76c09c1a8870824b6d4718afbabacf6f9a17",
    "entries": [
      {
        "category": "crypto",
        "condition": null,
        "evidence_hash": "851d8610f4a6f90f973227c5c75ceb902eb8a4f3ff20dc775e21cb303fa0f6d2",
        "feature": "ecdsa_recover",
        "note": "not used by the locked CBridge source; no host support claim",
        "status": "unknown"
      },
      {
        "category": "crypto",
        "condition": null,
        "evidence_hash": "851d8610f4a6f90f973227c5c75ceb902eb8a4f3ff20dc775e21cb303fa0f6d2",
        "feature": "keccak256",
        "note": "source-level hashlock and transfer-id derivations use keccak256",
        "status": "supported"
      },
      {
        "category": "crypto",
        "condition": null,
        "evidence_hash": "851d8610f4a6f90f973227c5c75ceb902eb8a4f3ff20dc775e21cb303fa0f6d2",
        "feature": "ripemd160",
        "note": "not used by the locked CBridge source; no host support claim",
        "status": "unknown"
      },
      {
        "category": "crypto",
        "condition": null,
        "evidence_hash": "851d8610f4a6f90f973227c5c75ceb902eb8a4f3ff20dc775e21cb303fa0f6d2",
        "feature": "sha256",
        "note": "not used by the locked CBridge source; no host support claim",
        "status": "unknown"
      },
      {
        "category": "opcode",
        "condition": null,
        "evidence_hash": "3882a177a7e1e767b7f37c2b8f8dd0112f26f356e3e12b0b509330a327d0cc17",
        "feature": "CALL",
        "note": "opcode is present in the locked deployed bytecode; native Foundry replay executes the host artifact",
        "status": "supported"
      },
      {
        "category": "opcode",
        "condition": null,
        "evidence_hash": "3882a177a7e1e767b7f37c2b8f8dd0112f26f356e3e12b0b509330a327d0cc17",
        "feature": "CALLDATACOPY",
        "note": "opcode is present in the locked deployed bytecode; native Foundry replay executes the host artifact",
        "status": "supported"
      },
      {
        "category": "opcode",
        "condition": null,
        "evidence_hash": "3882a177a7e1e767b7f37c2b8f8dd0112f26f356e3e12b0b509330a327d0cc17",
        "feature": "CALLDATASIZE",
        "note": "opcode is present in the locked deployed bytecode; native Foundry replay executes the host artifact",
        "status": "supported"
      },
      {
        "category": "opcode",
        "condition": null,
        "evidence_hash": "3882a177a7e1e767b7f37c2b8f8dd0112f26f356e3e12b0b509330a327d0cc17",
        "feature": "CALLER",
        "note": "opcode is present in the locked deployed bytecode; native Foundry replay executes the host artifact",
        "status": "supported"
      },
      {
        "category": "opcode",
        "condition": null,
        "evidence_hash": "3882a177a7e1e767b7f37c2b8f8dd0112f26f356e3e12b0b509330a327d0cc17",
        "feature": "CALLVALUE",
        "note": "opcode is present in the locked deployed bytecode; native Foundry replay executes the host artifact",
        "status": "supported"
      },
      {
        "category": "opcode",
        "condition": null,
        "evidence_hash": "3882a177a7e1e767b7f37c2b8f8dd0112f26f356e3e12b0b509330a327d0cc17",
        "feature": "CHAINID",
        "note": "opcode is present in the locked deployed bytecode; native Foundry replay executes the host artifact",
        "status": "supported"
      },
      {
        "category": "opcode",
        "condition": null,
        "evidence_hash": "3882a177a7e1e767b7f37c2b8f8dd0112f26f356e3e12b0b509330a327d0cc17",
        "feature": "CREATE",
        "note": "not observed in the locked deployed bytecode; no support claim is admitted without a dedicated probe",
        "status": "unknown"
      },
      {
        "category": "opcode",
        "condition": null,
        "evidence_hash": "3882a177a7e1e767b7f37c2b8f8dd0112f26f356e3e12b0b509330a327d0cc17",
        "feature": "CREATE2",
        "note": "not observed in the locked deployed bytecode; no support claim is admitted without a dedicated probe",
        "status": "unknown"
      },
      {
        "category": "opcode",
        "condition": null,
        "evidence_hash": "3882a177a7e1e767b7f37c2b8f8dd0112f26f356e3e12b0b509330a327d0cc17",
        "feature": "DELEGATECALL",
        "note": "not observed in the locked deployed bytecode; no support claim is admitted without a dedicated probe",
        "status": "unknown"
      },
      {
        "category": "opcode",
        "condition": null,
        "evidence_hash": "3882a177a7e1e767b7f37c2b8f8dd0112f26f356e3e12b0b509330a327d0cc17",
        "feature": "EXTCODEHASH",
        "note": "opcode is present in the locked deployed bytecode; native Foundry replay executes the host artifact",
        "status": "supported"
      },
      {
        "category": "opcode",
        "condition": null,
        "evidence_hash": "3882a177a7e1e767b7f37c2b8f8dd0112f26f356e3e12b0b509330a327d0cc17",
        "feature": "PUSH0",
        "note": "not observed in the locked deployed bytecode; no support claim is admitted without a dedicated probe",
        "status": "unknown"
      },
      {
        "category": "opcode",
        "condition": null,
        "evidence_hash": "3882a177a7e1e767b7f37c2b8f8dd0112f26f356e3e12b0b509330a327d0cc17",
        "feature": "RETURNDATACOPY",
        "note": "opcode is present in the locked deployed bytecode; native Foundry replay executes the host artifact",
        "status": "supported"
      },
      {
        "category": "opcode",
        "condition": null,
        "evidence_hash": "3882a177a7e1e767b7f37c2b8f8dd0112f26f356e3e12b0b509330a327d0cc17",
        "feature": "RETURNDATASIZE",
        "note": "not observed in the locked deployed bytecode; no support claim is admitted without a dedicated probe",
        "status": "unknown"
      },
      {
        "category": "opcode",
        "condition": null,
        "evidence_hash": "3882a177a7e1e767b7f37c2b8f8dd0112f26f356e3e12b0b509330a327d0cc17",
        "feature": "SELFBALANCE",
        "note": "opcode is present in the locked deployed bytecode; native Foundry replay executes the host artifact",
        "status": "supported"
      },
      {
        "category": "opcode",
        "condition": null,
        "evidence_hash": "3882a177a7e1e767b7f37c2b8f8dd0112f26f356e3e12b0b509330a327d0cc17",
        "feature": "SELFDESTRUCT",
        "note": "not observed in the locked deployed bytecode; no support claim is admitted without a dedicated probe",
        "status": "unknown"
      },
      {
        "category": "opcode",
        "condition": null,
        "evidence_hash": "3882a177a7e1e767b7f37c2b8f8dd0112f26f356e3e12b0b509330a327d0cc17",
        "feature": "SHA3",
        "note": "opcode is present in the locked deployed bytecode; native Foundry replay executes the host artifact",
        "status": "supported"
      },
      {
        "category": "opcode",
        "condition": null,
        "evidence_hash": "3882a177a7e1e767b7f37c2b8f8dd0112f26f356e3e12b0b509330a327d0cc17",
        "feature": "SLOAD",
        "note": "opcode is present in the locked deployed bytecode; native Foundry replay executes the host artifact",
        "status": "supported"
      },
      {
        "category": "opcode",
        "condition": null,
        "evidence_hash": "3882a177a7e1e767b7f37c2b8f8dd0112f26f356e3e12b0b509330a327d0cc17",
        "feature": "SSTORE",
        "note": "opcode is present in the locked deployed bytecode; native Foundry replay executes the host artifact",
        "status": "supported"
      },
      {
        "category": "opcode",
        "condition": null,
        "evidence_hash": "3882a177a7e1e767b7f37c2b8f8dd0112f26f356e3e12b0b509330a327d0cc17",